{
  "schema_version": "1.3",
  "entry_academic_year": "112",
  "degree_level": "bachelor",
  "retrieved_at": "2026-08-22T15:34:07Z",
  "department_count": 25,
  "requirements": [
    {
      "department_code": "B1010",
      "department_name": "中國文學系",
      "degree_level": "bachelor",
      "entry_academic_year": "112",
      "minimum_graduation_credits": 128,
      "required_course_ratio": null,
      "source": {
        "url": "https://selcrs.nsysu.edu.tw/stu_query/crs_mst_qry/crs_mst_query.asp?action=3&YY1=112&DPT1=B1010",
        "retrieved_at": "2026-08-22T15:34:07Z",
        "binary_sha256": "1f1a58d3ff11c0b7456a6bd96bf243cff5dd29b8e925e29213d8a14812573d62",
        "http_status": 200,
        "parser_version": "graduation-rules-1.0.0"
      }
    },
    {
      "department_code": "B1020",
      "department_name": "外國語文學系",
      "degree_level": "bachelor",
      "entry_academic_year": "112",
      "minimum_graduation_credits": 128,
      "required_course_ratio": null,
      "source": {
        "url": "https://selcrs.nsysu.edu.tw/stu_query/crs_mst_qry/crs_mst_query.asp?action=3&YY1=112&DPT1=B1020",
        "retrieved_at": "2026-08-22T15:34:07Z",
        "binary_sha256": "0a662f53d4b84ec4e05c8013e064138a0b62f75b294a21f2ef174d8e39a02507",
        "http_status": 200,
        "parser_version": "graduation-rules-1.0.0"
      }
    },
    {
      "department_code": "B1030",
      "department_name": "音樂學系",
      "degree_level": "bachelor",
      "entry_academic_year": "112",
      "minimum_graduation_credits": 128,
      "required_course_ratio": null,
      "source": {
        "url": "https://selcrs.nsysu.edu.tw/stu_query/crs_mst_qry/crs_mst_query.asp?action=3&YY1=112&DPT1=B1030",
        "retrieved_at": "2026-08-22T15:34:07Z",
        "binary_sha256": "e3a58fd1eb06218d613a09a92b7391ec25d95fc1bf4065bde96c366c3fb6d50d",
        "http_status": 200,
        "parser_version": "graduation-rules-1.0.0"
      }
    },
    {
      "department_code": "B1060",
      "department_name": "劇場藝術學系",
      "degree_level": "bachelor",
      "entry_academic_year": "112",
      "minimum_graduation_credits": 128,
      "required_course_ratio": null,
      "source": {
        "url": "https://selcrs.nsysu.edu.tw/stu_query/crs_mst_qry/crs_mst_query.asp?action=3&YY1=112&DPT1=B1060",
        "retrieved_at": "2026-08-22T15:34:07Z",
        "binary_sha256": "574a59e736907de283ddf65046b93e29865379ba03d3fb704ee4e29d257d0f26",
        "http_status": 200,
        "parser_version": "graduation-rules-1.0.0"
      }
    },
    {
      "department_code": "B2010",
      "department_name": "生物科學系",
      "degree_level": "bachelor",
      "entry_academic_year": "112",
      "minimum_graduation_credits": 128,
      "required_course_ratio": null,
      "source": {
        "url": "https://selcrs.nsysu.edu.tw/stu_query/crs_mst_qry/crs_mst_query.asp?action=3&YY1=112&DPT1=B2010",
        "retrieved_at": "2026-08-22T15:34:07Z",
        "binary_sha256": "f09e1f15f3554be8944f0ea8e40443c0001fdbd742bcfe8ed3f72ce62dbd7e3e",
        "http_status": 200,
        "parser_version": "graduation-rules-1.0.0"
      }
    },
    {
      "department_code": "B2020",
      "department_name": "化學系",
      "degree_level": "bachelor",
      "entry_academic_year": "112",
      "minimum_graduation_credits": 128,
      "required_course_ratio": null,
      "source": {
        "url": "https://selcrs.nsysu.edu.tw/stu_query/crs_mst_qry/crs_mst_query.asp?action=3&YY1=112&DPT1=B2020",
        "retrieved_at": "2026-08-22T15:34:07Z",
        "binary_sha256": "7e26854fd58241a69f4afe4fa21916d5acc188090104f0ba6a0ce5a2d99d52c9",
        "http_status": 200,
        "parser_version": "graduation-rules-1.0.0"
      }
    },
    {
      "department_code": "B2030",
      "department_name": "物理學系",
      "degree_level": "bachelor",
      "entry_academic_year": "112",
      "minimum_graduation_credits": 128,
      "required_course_ratio": null,
      "source": {
        "url": "https://selcrs.nsysu.edu.tw/stu_query/crs_mst_qry/crs_mst_query.asp?action=3&YY1=112&DPT1=B2030",
        "retrieved_at": "2026-08-22T15:34:07Z",
        "binary_sha256": "eeb94be8254dc247052f066992962501c92d62b359b76f5f34c684f63723f74c",
        "http_status": 200,
        "parser_version": "graduation-rules-1.0.0"
      }
    },
    {
      "department_code": "B2040",
      "department_name": "應用數學系",
      "degree_level": "bachelor",
      "entry_academic_year": "112",
      "minimum_graduation_credits": 128,
      "required_course_ratio": null,
      "source": {
        "url": "https://selcrs.nsysu.edu.tw/stu_query/crs_mst_qry/crs_mst_query.asp?action=3&YY1=112&DPT1=B2040",
        "retrieved_at": "2026-08-22T15:34:07Z",
        "binary_sha256": "09404ba410bab9c7d667c301be8e85d5ce2842db51f8cda50b7d708398ddd4a4",
        "http_status": 200,
        "parser_version": "graduation-rules-1.0.0"
      }
    },
    {
      "department_code": "B3010",
      "department_name": "電機工程學系",
      "degree_level": "bachelor",
      "entry_academic_year": "112",
      "minimum_graduation_credits": 132,
      "required_course_ratio": null,
      "source": {
        "url": "https://selcrs.nsysu.edu.tw/stu_query/crs_mst_qry/crs_mst_query.asp?action=3&YY1=112&DPT1=B3010",
        "retrieved_at": "2026-08-22T15:34:07Z",
        "binary_sha256": "bab7f026260397d1f2db3bfe1f92c6e2583a2f043a0ab43f3015389326fc8fdd",
        "http_status": 200,
        "parser_version": "graduation-rules-1.0.0"
      }
    },
    {
      "department_code": "B3020",
      "department_name": "機械與機電工程學系",
      "degree_level": "bachelor",
      "entry_academic_year": "112",
      "minimum_graduation_credits": 137,
      "required_course_ratio": null,
      "source": {
        "url": "https://selcrs.nsysu.edu.tw/stu_query/crs_mst_qry/crs_mst_query.asp?action=3&YY1=112&DPT1=B3020",
        "retrieved_at": "2026-08-22T15:34:07Z",
        "binary_sha256": "d03cd0d1f09de3316f8630cc7d8f8fccf763729c35c4c3ab46da6992420613f6",
        "http_status": 200,
        "parser_version": "graduation-rules-1.0.0"
      }
    },
    {
      "department_code": "B3040",
      "department_name": "資訊工程學系",
      "degree_level": "bachelor",
      "entry_academic_year": "112",
      "minimum_graduation_credits": 135,
      "required_course_ratio": null,
      "source": {
        "url": "https://selcrs.nsysu.edu.tw/stu_query/crs_mst_qry/crs_mst_query.asp?action=3&YY1=112&DPT1=B3040",
        "retrieved_at": "2026-08-22T15:34:07Z",
        "binary_sha256": "6ae5a212e0b1476ddcada9b3356df26969058585b93a120d6f7fa8ab98df887e",
        "http_status": 200,
        "parser_version": "graduation-rules-1.0.0"
      }
    },
    {
      "department_code": "B3090",
      "department_name": "光電工程學系",
      "degree_level": "bachelor",
      "entry_academic_year": "112",
      "minimum_graduation_credits": 139,
      "required_course_ratio": null,
      "source": {
        "url": "https://selcrs.nsysu.edu.tw/stu_query/crs_mst_qry/crs_mst_query.asp?action=3&YY1=112&DPT1=B3090",
        "retrieved_at": "2026-08-22T15:34:07Z",
        "binary_sha256": "28461726bd9ccd054b3a712bee8f9d0dace11b7cbeb64cf5ea31f4f35bf77b5a",
        "http_status": 200,
        "parser_version": "graduation-rules-1.0.0"
      }
    },
    {
      "department_code": "B3100",
      "department_name": "材料與光電科學學系",
      "degree_level": "bachelor",
      "entry_academic_year": "112",
      "minimum_graduation_credits": 132,
      "required_course_ratio": null,
      "source": {
        "url": "https://selcrs.nsysu.edu.tw/stu_query/crs_mst_qry/crs_mst_query.asp?action=3&YY1=112&DPT1=B3100",
        "retrieved_at": "2026-08-22T15:34:07Z",
        "binary_sha256": "d63551f0480a819e8a26d68ce1c6ee1d21e4e9c478ed4e701eede358363c83f6",
        "http_status": 200,
        "parser_version": "graduation-rules-1.0.0"
      }
    },
    {
      "department_code": "B3240",
      "department_name": "資訊工程學系全英語學士班",
      "degree_level": "bachelor",
      "entry_academic_year": "112",
      "minimum_graduation_credits": 135,
      "required_course_ratio": null,
      "source": {
        "url": "https://selcrs.nsysu.edu.tw/stu_query/crs_mst_qry/crs_mst_query.asp?action=3&YY1=112&DPT1=B3240",
        "retrieved_at": "2026-08-22T15:34:07Z",
        "binary_sha256": "d90379fdade6094e7650e17a8f9cc65f4f315d1db113e79dc55212118881371b",
        "http_status": 200,
        "parser_version": "graduation-rules-1.0.0"
      }
    },
    {
      "department_code": "B4010",
      "department_name": "企業管理學系",
      "degree_level": "bachelor",
      "entry_academic_year": "112",
      "minimum_graduation_credits": 128,
      "required_course_ratio": null,
      "source": {
        "url": "https://selcrs.nsysu.edu.tw/stu_query/crs_mst_qry/crs_mst_query.asp?action=3&YY1=112&DPT1=B4010",
        "retrieved_at": "2026-08-22T15:34:07Z",
        "binary_sha256": "0aff9cb6db9c7b1d09c9984f6a8740322a813138f0b33fe242b799c41e138e5d",
        "http_status": 200,
        "parser_version": "graduation-rules-1.0.0"
      }
    },
    {
      "department_code": "B4020",
      "department_name": "資訊管理學系",
      "degree_level": "bachelor",
      "entry_academic_year": "112",
      "minimum_graduation_credits": 135,
      "required_course_ratio": null,
      "source": {
        "url": "https://selcrs.nsysu.edu.tw/stu_query/crs_mst_qry/crs_mst_query.asp?action=3&YY1=112&DPT1=B4020",
        "retrieved_at": "2026-08-22T15:34:07Z",
        "binary_sha256": "2a1d0d82cbe150e0dc5941be525407c5ee80d817be2238fbfd6db8596670f705",
        "http_status": 200,
        "parser_version": "graduation-rules-1.0.0"
      }
    },
    {
      "department_code": "B4030",
      "department_name": "財務管理學系",
      "degree_level": "bachelor",
      "entry_academic_year": "112",
      "minimum_graduation_credits": 140,
      "required_course_ratio": null,
      "source": {
        "url": "https://selcrs.nsysu.edu.tw/stu_query/crs_mst_qry/crs_mst_query.asp?action=3&YY1=112&DPT1=B4030",